{
  "schema_version": 1,
  "version": null,
  "oxidex_sha": null,
  "oxidex_tree": null,
  "source_dirty": null,
  "exiftool_version": null,
  "created_at": null,
  "required_families": ["conformance", "authenticated_reads", "generated_catalog", "write_matrix"],
  "scope_exclusions": [],
  "binary": {"path": null, "sha256": null, "build_proof_path": null, "build_proof_sha256": null, "cargo_target_dir": null},
  "oracle": {
    "status": "unverified",
    "perl_path": null,
    "perl_version": null,
    "perl_sha256": null,
    "tree_path": null,
    "script_sha256": null,
    "library_fingerprint_path": null,
    "library_fingerprint_sha256": null,
    "probes": []
  },
  "corpora": [],
  "runs": [],
  "conformance": {
    "status": "unverified",
    "instrument": "tools/exiftool-tables/conformance.py",
    "artifacts": [],
    "files": null,
    "matched": null,
    "missing": null,
    "value_diff": null,
    "renames": null,
    "extra": null,
    "native_scored_denominator": null,
    "score": null,
    "rename_ceiling": null,
    "precision_denominator": null,
    "precision": null,
    "per_format_artifact": null,
    "per_file_artifact": null,
    "detected_only_formats": [],
    "identity_and_exclusion_policy": null
  },
  "authenticated_reads": {
    "status": "unverified",
    "instrument": "tools/exiftool-tables/corpus_read_receipt.py",
    "receipts": [],
    "verification_runs": [],
    "metric_c": null,
    "native_occurrence_floor": null,
    "native_occurrence_floor_evidence": null,
    "credited_coordinates_artifact": null,
    "published_read_gate": {
      "status": "unverified", "exit_code": null, "log": null,
      "snapshot_path": null, "snapshot_sha256": null, "snapshot_source_commit": null,
      "catalog_path": null, "catalog_sha256": null, "lost_reads": null
    }
  },
  "generated_catalog": {
    "status": "unverified",
    "instrument": "tools/ci/parity_ratchet.py",
    "artifacts": [],
    "source_commit": null,
    "generator_commit": null,
    "counts_and_denominators": null,
    "ratchet_exit_code": null,
    "floors_path": null,
    "floors_sha256": null,
    "observed_read_credit": false
  },
  "write_matrix": {
    "status": "unverified",
    "instrument": "jpeg-tag-matrix",
    "artifacts": [],
    "format_scope": "JPEG",
    "fixture_path": null,
    "fixture_sha256": null,
    "manifest_sha256": null,
    "baseline_sha256": null,
    "options": [],
    "counts_and_denominators": null,
    "success_criterion": null,
    "report_exit_code": null
  },
  "regressions": {
    "status": "unverified",
    "base_sha": null,
    "head_sha": null,
    "fresh_base_receipt": null,
    "fresh_head_receipt": null,
    "scope_equivalence_artifact": null,
    "per_file_delta_artifact": null,
    "new_losses": null,
    "new_value_differences": null,
    "extra_delta": null
  },
  "status": "unverified",
  "refusals": [],
  "unresolved": ["Probe the canonical oracle and collect fresh, scoped evidence before populating measurements."]
}
